{
  "schemaVersion": "1.0.0",
  "id": "snap-win-main-01-0002",
  "displayName": "刷模块前",
  "instanceRef": "win-main-01",
  "imageRef": "bliss-os-17-x86_64",
  "createdAt": "2026-10-07T14:05:30+08:00",
  "state": "ready",
  "parentRef": "snap-win-main-01-0001",
  "note": "刷入 Magisk 前留的还原点，确认可回退到已验证 root 的状态",
  "platformConfig": {
    "diskChain": {
      "depth": 2,
      "layers": [
        { "path": "instances/win-main-01/snap-0002.qcow2", "role": "top" },
        { "path": "instances/win-main-01/snap-0001.qcow2", "role": "backing" }
      ]
    }
  }
}